"issue_id","attribute_id","is_related","relevant_contents","label"
847848705,17,1.0,"This PR adds unit and block fixture parsing tests to the Subscriptions block, and refactors the block for maintainability and to make it more testable.",maybe-relevant
498285103,17,0.5,I think I've said my piece here. Sorry my decision to improve the maintainability of a module downloaded nearly 60 million times a week doesn't fit your business model.,maybe-not-relevant
555017174,18,1.0,We could be doing more to help people with compatibility between the playwright package version and the specific branded browser they have.,maybe-relevant
555546366,18,1.0,"Currently, playwright-core is guaranteed to work only with Chrome 81 - which is Chrome Canary. Puppeteer has a compatibility table to match puppeteer-core versions against separately-installed browser versions.







",maybe-relevant
570117009,18,1.0,I think compatibility between playwright and msw should be a pretty important consideration in playwright development.,maybe-relevant
570832604,18,0.5,"Later on, we can validate our api.md against this interface instead of implementation, because typescript should check the interface <-> implementation compatibility for us.",maybe-not-relevant
571155001,18,1.0,"It's not really what you want, but the Onslip Automation Library I've mentioned here before recently gained compatibility with @playwright/test, enabling E2E testing on real (from ancient to modern) Android and iOS devices plus Android emulators via Playwright Test (unfortunately no Simulator support yet).",maybe-relevant
5712615,18,0.0,,not-relevant
8359922,18,0.0,,not-relevant
8731467,18,0.0,,not-relevant
8771029,18,0.0,,not-relevant
8952986,18,0.0,,not-relevant
24604880,18,1.0,"Couldn't this break backward compatibility with something expecting the caption to come in as an argument to the shortcode, rather than just appended to the contents?",maybe-relevant
26240046,18,1.0,"I agree that your version makes more sense but for backwards compatibility I would keep the apply_filters('grunion_contact_form_field_html') in the render function after defining $r, an old theme could be expecting that value.",maybe-relevant
27306584,18,1.0,"The show_subject attribute is there for backward compatibility, and I don't think something we're actively supporting.",maybe-relevant
28925562,18,1.0,improve compatibility with bbPress' Forums root...It's currently not possible to apply any Widget conditions to that particular page. We should see about adding extra rules using bbPress' conditional tags when bbPress is active.,maybe-relevant
29326365,18,1.0,"Add compatibility for WP 3.9 Widget Customizer
... The method that Widget Visibility uses to force a widget wide, however, does not work in the customizer, since widgets cannot be left-overhanging.",maybe-relevant
1412909,18,1.0,"that is a other issues than this, this was web socket spec compatibility and that was added.",maybe-relevant
2242432,18,1.0,"The issue is not compatibility, it is pollution. Most loaders can handle plain old JavaScript files, but the issue remains that they pollute the global scope. ",maybe-relevant
2457994,18,1.0,If you guys would accept something like this I'll do the work with full compatibility and tests.,maybe-relevant
36975564,18,1.0,Of course this breaks SSL compatibility for XMLHttpRequests.,maybe-relevant
37747998,18,1.0,Are there plans to provide support for component.js? Would rather see this implemented here than a fork of the code.,maybe-relevant
558608874,20,0.0,,not-relevant
9276280,20,0.0,,not-relevant
525205531,2,1.0,We should have something like compat tables in the api docs.,maybe-relevant
533665625,2,1.0,"These new types include private stuff that they probably shouldn't, and are missing documentation.",maybe-relevant
553975941,2,1.0,This change edits the suggested documentation message so that it points to a valid URL.,maybe-relevant
554822353,2,1.0,"We can have different defaults externally vs internally (e.g. ElementHandle wrapping HTMLElement by default), have short documentation attached to be shown in IDEs, and not pollute types with internal methods starting with underscore.",maybe-relevant
554883000,2,1.0,"You can send a PR editing documentation source, it will be reflected on playwright.dev.",maybe-relevant
4256125,2,1.0,About documentation to add please be more clear.,maybe-relevant
4426906,2,1.0,We offer a way to search the codeshare site and/or documentation site for help,maybe-relevant
4458814,2,0.0,,not-relevant
4649277,2,0.0,,not-relevant
4705104,2,0.0,,not-relevant
24430363,2,0.0,,not-relevant
24432494,2,0.0,,not-relevant
26564295,2,1.0,Leave a note for the Jetpack Happiness Engineers on how the git submodule works so they can update support documentation,maybe-relevant
27290722,2,0.0,,not-relevant
28264608,2,0.0,,not-relevant
228723,2,1.0,"There is either need for such a functionality, or a need for its documentation on http://socket.io/",maybe-relevant
671665,2,1.0,"I cannot find anything in the documentation but I am sure that a port is required to access anything in the ""/socket.io"" directory of the domain as per the installation instructions.",maybe-relevant
679366,2,1.0,any documentation on how to do this?,maybe-relevant
942690,2,1.0,From the only documentation I see (readme.md) I cannot tell which timeout I'd need to set here.,maybe-relevant
1103129,2,0.5,The documentation says,maybe-not-relevant
